{
  "version": 1,
  "id": "skill-create-001",
  "skill": "skill-create",
  "task": "Verify generated skill adheres to naming, description token budget, and structure constraints.",
  "harness": "agy",
  "role": "builder",
  "seed": 1337,
  "repeats": 3,
  "timeout_s": 60,
  "max_tokens": 10000,
  "checker": "check.mjs",
  "checker_sha256": "88355b59ded2ee7f6e4aab20f44b45227358d2ffaffb37aafed900368e47a7ee",
  "expected": "expected.json",
  "expected_sha256": "22f1949145f91e6ad3ca78fd0e47300825ca14d5cb2e07eb046242ab92769c25",
  "origin": {
    "kind": "handwritten"
  },
  "tags": ["target", "validation"]
}
